tender_id,name,organization,location,submission_deadline,initiation_date,details_url,original_source_url,original_source_type,found_in_section
396943-2025,Poland – Repair and maintenance services – Świadczenie usług serwisowania sprzętu medycznego na potrzeby Zakładów i Pracowni Stomatologicznych oraz Klinik Psychiatrycznych Centralnego Szpitala Klinicznego Uniwersytetu Medycznego w Łodzi,Samodzielny Publiczny Zakład Opieki Zdrowotnej Centralny Szpital Kliniczny Uniwersytetu Medycznego w Łodzi,Poland,,2025-06-19,https://ted.europa.eu/en/notice/-/detail/396943-2025,https://platformazakupowa.pl/pn/csk_umed,platformazakupowa,General links
396495-2025,Poland – Repair and maintenance services – Świadczenie usług serwisowania sprzętu medycznego na potrzeby Zakładów i Pracowni Stomatologicznych oraz Klinik Psychiatrycznych Centralnego Szpitala Klinicznego Uniwersytetu Medycznego w Łodzi,Samodzielny Publiczny Zakład Opieki Zdrowotnej Centralny Szpital Kliniczny Uniwersytetu Medycznego w Łodzi,Poland,,2025-06-19,https://ted.europa.eu/en/notice/-/detail/396495-2025,https://platformazakupowa.pl/pn/csk_umed,platformazakupowa,General links
396504-2025,"Poland – Solar photovoltaic modules – dostawa paneli fotowoltaicznych z magazynami energii wraz z instalacją i wykonaniem Carportów -wiat samochodowych skomponowanych z fotowoltaiką na terenie parkingu przed budynkiem Szpitala przy ul. Zegadłowicza 3 w Sosnowcu, w ramach projektu pn. ""Zrównoważony Szpital: Budowa systemu fotowoltaicznego dla Sosnowieckiego Szpitala Miejskiego""","Sosnowiecki Szpital Miejski sp. z o.o., w restrukturyzacji",Poland,2025-06-25 11:00,2025-06-19,https://ted.europa.eu/en/notice/-/detail/396504-2025,https://europa.eu/european-union/contact/institutions-bodies_en,unknown_platform_europa.eu,General page scan
396544-2025,"Poland – Refuse-incineration plant construction work – „Budowa instalacji kogeneracji do produkcji energii z przetworzonych odpadów komunalnych z wykorzystaniem ciepła do miejskiej sieci ciepłowniczej w Tarnowie"".",Miejskie Przedsiębiorstwo Energetyki Cieplnej S.A.,Poland,2025-07-07 10:00,2025-06-19,https://ted.europa.eu/en/notice/-/detail/396544-2025,https://platformazakupowa.pl/transakcja/1002192,platformazakupowa,General links
395965-2025,"Poland – Medical equipments – Doposażenie bloku zabiegowego Oddziału Urologicznego w aparaty do znieczuleń, respirator, ramie C, stoły operacyjne, defibrylator w ramach projektu pn. LeanHealthcare jako narzędzie poprawy dostępu do medycyny specjalistycznej - dofinansowane ze środków INTERREG NEXT Polska - Ukraina",Szpital Wojewódzki im. dr. Ludwika Rydygiera w Suwałkach,Poland,,2025-06-19,https://ted.europa.eu/en/notice/-/detail/395965-2025,https://europa.eu/european-union/contact/institutions-bodies_en,unknown_platform_europa.eu,General page scan
396030-2025,Poland – Prepared animal feeds for farm and other animals – Aminokwas L-lizyna,"Instytut Zootechniki - Państwowy Instytut Badawczy 31-047 Kraków, ul. Sarego 2 Zakład Doświadczalny Pawłowice",Poland,2025-07-22 09:00,2025-06-19,https://ted.europa.eu/en/notice/-/detail/396030-2025,https://ezamowienia.gov.pl,ezamowienia,General links
395950-2025,"Poland – Medical equipments – DOSTAWA SPRZĘTU MEDYCZNEGO (sprzęt do endoskopii) W RAMACH PROGRAMU „Rozwój onkologii w Sosnowieckim Szpitalu Miejskim w ramach sieci SOLO w kierunku diagnostyki i zabiegów na chirurgii, ginekologii oraz urologii",Sosnowiecki Szpital Miejski Sp. z o.o. w restrukturyzacji,Poland,2025-06-17 11:00,2025-06-19,https://ted.europa.eu/en/notice/-/detail/395950-2025,https://europa.eu/european-union/contact/institutions-bodies_en,unknown_platform_europa.eu,General page scan
395675-2025,Poland – Repair and maintenance services – Świadczenie usług serwisowania sprzętu medycznego na potrzeby Zakładów i Pracowni Stomatologicznych oraz Klinik Psychiatrycznych Centralnego Szpitala Klinicznego Uniwersytetu Medycznego w Łodzi,Samodzielny Publiczny Zakład Opieki Zdrowotnej Centralny Szpital Kliniczny Uniwersytetu Medycznego w Łodzi,Poland,,2025-06-19,https://ted.europa.eu/en/notice/-/detail/395675-2025,https://platformazakupowa.pl/pn/csk_umed,platformazakupowa,General links
398774-2025,Poland – Wastewater treatment plant construction work – Wykonanie robót budowlanych polegających na rozbudowie i modernizacji oczyszczalni ścieków w Działdowie w ramach projektu pn.: „Realizacja zobowiązań wynikających z Dyrektywy 91/271/EWG na terenie aglomeracji Działdowo – rozbudowa i modernizacja oczyszczalni ścieków w Działdowie”,Przedsiębiorstwo Gospodarki Komunalnej i Mieszkaniowej Sp. z o.o.,Poland,2025-07-04 10:00,2025-06-19,https://ted.europa.eu/en/notice/-/detail/398774-2025,https://ezamowienia.gov.pl/pl,ezamowienia,General links
398799-2025,Poland – Network equipment – Dostawa urządzeń sieciowych na potrzeby Instytutu Nauk Technicznych,Uniwersytet Komisji Edukacji Narodowej w Krakowie,Poland,2025-07-10 09:00,2025-06-19,https://ted.europa.eu/en/notice/-/detail/398799-2025,https://platformazakupowa.pl/transakcja/1120716,platformazakupowa,General links
398873-2025,"Poland – Solar installation – Zaprojektowanie i dostawa instalacji fotowoltaicznych, magazynów energii oraz powietrznych pomp ciepła w ramach zadania inwestycyjnego pn.„Odnawialne źródła energii w Gminie Rusiec – edycja 2”",GMINA RUSIEC,Poland,2025-07-07 10:00,2025-06-19,https://ted.europa.eu/en/notice/-/detail/398873-2025,https://ezamowienia.gov.pl/mp-client/search/list/ocds-148610-8a1b961c-caa2-43de-9b76-39fc5e8eadad,ezamowienia,General links
397798-2025,Poland – Repair and maintenance services – Świadczenie usług serwisowania sprzętu medycznego na potrzeby Zakładów i Pracowni Stomatologicznych oraz Klinik Psychiatrycznych Centralnego Szpitala Klinicznego Uniwersytetu Medycznego w Łodzi,Samodzielny Publiczny Zakład Opieki Zdrowotnej Centralny Szpital Kliniczny Uniwersytetu Medycznego w Łodzi,Poland,,2025-06-19,https://ted.europa.eu/en/notice/-/detail/397798-2025,https://platformazakupowa.pl/pn/csk_umed,platformazakupowa,General links
398494-2025,Poland – Credit granting services – Zaciągnięcie kredytu długoterminowego na sfinansowanie planowanego deficytu budżetu Gminy Miejskiej Szczytno na rok 2025 oraz spłatę wcześniej zaciągniętych zobowiązań z tytułu kredytów i pożyczek,Gmina Miejska Szczytno,Poland,2025-07-24 10:00,2025-06-19,https://ted.europa.eu/en/notice/-/detail/398494-2025,https://platformazakupowa.pl/pn/miasto_szczytno,platformazakupowa,General links
396466-2025,Poland – Repair and maintenance services – Świadczenie usług serwisowania sprzętu medycznego na potrzeby Zakładów i Pracowni Stomatologicznych oraz Klinik Psychiatrycznych Centralnego Szpitala Klinicznego Uniwersytetu Medycznego w Łodzi,Samodzielny Publiczny Zakład Opieki Zdrowotnej Centralny Szpital Kliniczny Uniwersytetu Medycznego w Łodzi,Poland,,2025-06-19,https://ted.europa.eu/en/notice/-/detail/396466-2025,https://platformazakupowa.pl/pn/csk_umed,platformazakupowa,General links
397263-2025,Poland – Repair and maintenance services – Świadczenie usług serwisowania sprzętu medycznego na potrzeby Zakładów i Pracowni Stomatologicznych oraz Klinik Psychiatrycznych Centralnego Szpitala Klinicznego Uniwersytetu Medycznego w Łodzi,Samodzielny Publiczny Zakład Opieki Zdrowotnej Centralny Szpital Kliniczny Uniwersytetu Medycznego w Łodzi,Poland,,2025-06-19,https://ted.europa.eu/en/notice/-/detail/397263-2025,https://platformazakupowa.pl/pn/csk_umed,platformazakupowa,General links
397351-2025,Poland – Financial and insurance services – „Wybór Partnerów Finansujących w celu wdrażania Instrumentu Finansowego Pożyczka na efektywność energetyczną w budynkach użyteczności publicznej/ Pożyczka na efektywność energetyczną w budynkach użyteczności publicznej (IIT) w ramach Funduszu Powierniczego Województwa Lubelskiego,Bank Gospodarstwa Krajowego,Poland,,2025-06-19,https://ted.europa.eu/en/notice/-/detail/397351-2025,https://bgk.eb2b.com.pl,eb2b,General links
397160-2025,Poland – Barcode readers – Zakup sprzętu do systemu GS1,Narodowy Bank Polski,Poland,2025-07-11 12:00,2025-06-19,https://ted.europa.eu/en/notice/-/detail/397160-2025,https://europa.eu/european-union/contact/institutions-bodies_en,unknown_platform_europa.eu,General page scan
397476-2025,"Poland – Spare parts for goods vehicles, vans and cars – Sukcesywne dostawy części do autobusów marki Solaris",MIEJSKIE PRZEDSIĘBIORSTWO KOMUNIKACYJNE SPÓŁKA AKCYJNA W KRAKOWIE,Poland,,2025-06-19,https://ted.europa.eu/en/notice/-/detail/397476-2025,https://europa.eu/european-union/contact/institutions-bodies_en,unknown_platform_europa.eu,General page scan
397495-2025,Poland – Mainframe computer – 21/25-Zakup i dostawa sprzętu informatycznego dla potrzeb jednostek Policji garnizonu mazowieckiego,Komenda Wojewódzka Policji z siedzibą w Radomiu,Poland,2025-06-30 11:00,2025-06-19,https://ted.europa.eu/en/notice/-/detail/397495-2025,https://platformazakupowa.pl/pn/kwp_radom,platformazakupowa,General links
397534-2025,Poland – Repair and maintenance services – Świadczenie usług serwisowania sprzętu medycznego na potrzeby Zakładów i Pracowni Stomatologicznych oraz Klinik Psychiatrycznych Centralnego Szpitala Klinicznego Uniwersytetu Medycznego w Łodzi,Samodzielny Publiczny Zakład Opieki Zdrowotnej Centralny Szpital Kliniczny Uniwersytetu Medycznego w Łodzi,Poland,,2025-06-19,https://ted.europa.eu/en/notice/-/detail/397534-2025,https://platformazakupowa.pl/pn/csk_umed,platformazakupowa,General links
397897-2025,Poland – Repair and maintenance services – Świadczenie usług serwisowania sprzętu medycznego na potrzeby Zakładów i Pracowni Stomatologicznych oraz Klinik Psychiatrycznych Centralnego Szpitala Klinicznego Uniwersytetu Medycznego w Łodzi,Samodzielny Publiczny Zakład Opieki Zdrowotnej Centralny Szpital Kliniczny Uniwersytetu Medycznego w Łodzi,Poland,,2025-06-19,https://ted.europa.eu/en/notice/-/detail/397897-2025,https://platformazakupowa.pl/pn/csk_umed,platformazakupowa,General links
397924-2025,Poland – Software package and information systems – Budowa wspólnej infrastruktury informacji przestrzennej poprzez uruchomienie centralnej platformy planowania przestrzennego i udostępniania zasobów ISP w ramach projektu „Partnerstwo gmin subregionu chełmsko - zamojskiego dla upowszechnienia elektronicznych usług publicznych i dostępu do informacji przestrzennej”,Gmina Dorohusk,Poland,2025-06-26 10:00,2025-06-19,https://ted.europa.eu/en/notice/-/detail/397924-2025,https://dorohusk.ezamawiajacy.pl,ezamawiajacy,General links
398135-2025,"Poland – Cardiac stimulation devices – Dostawa stymulatorów resynchronizujących, stymulatorów jedno i dwujamowych, stymulatorów zewnętrznych, defibrylatorów wszczepialnych, elektrod oraz sprzętu pomocniczego",Samodzielny Publiczny Szpital Wojewódzki im. Papieża Jana Pawła II w Zamościu,Poland,,2025-06-19,https://ted.europa.eu/en/notice/-/detail/398135-2025,https://europa.eu/european-union/contact/institutions-bodies_en,unknown_platform_europa.eu,General page scan
398669-2025,Poland – Financial and insurance services – Wybór Partnerów Finansujących w celu wdrażania Instrumentu Finansowego „Pożyczka na OZE dla przedsiębiorstw” w ramach Programu Fundusze Europejskie dla Małopolski 2021-2027,Bank Gospodarstwa Krajowego,Poland,2025-06-26 11:00,2025-06-19,https://ted.europa.eu/en/notice/-/detail/398669-2025,https://bgk.eb2b.com.pl/open-preview-auction.html/477463,eb2b,Warunki udzielenia zamówienia
397487-2025,Poland – Reagents and contrast media – Zakup i sukcesywna dostawa odczynników do badań laboratoryjnych dla Polikliniki w Radomiu i Chiechanowie,Państwowy Instytut Medyczny Ministerstwa Spraw Wewnętrznych i Administracji,Poland,2025-06-27 11:00,2025-06-19,https://ted.europa.eu/en/notice/-/detail/397487-2025,https://europa.eu/european-union/contact/institutions-bodies_en,unknown_platform_europa.eu,General page scan
397663-2025,Poland – Repair and maintenance services – Świadczenie usług serwisowania sprzętu medycznego na potrzeby Zakładów i Pracowni Stomatologicznych oraz Klinik Psychiatrycznych Centralnego Szpitala Klinicznego Uniwersytetu Medycznego w Łodzi,Samodzielny Publiczny Zakład Opieki Zdrowotnej Centralny Szpital Kliniczny Uniwersytetu Medycznego w Łodzi,Poland,,2025-06-19,https://ted.europa.eu/en/notice/-/detail/397663-2025,https://platformazakupowa.pl/pn/csk_umed,platformazakupowa,General links
397705-2025,"Poland – Antiseptics and disinfectants – Dostawa środków do dezynfekcji powierzchni małych i dużych, narzędzi, sprzętu medycznego, dezynfekcji maszynowej, dekontaminacji ciała",Wielospecjalistyczny Szpital Miejski im.J.Strusia z Zakładem Opiekuńczo- Leczniczym SP ZOZ,Poland,2025-07-23 09:00,2025-06-19,https://ted.europa.eu/en/notice/-/detail/397705-2025,https://ezamowienia.gov.pl,ezamowienia,General links
397814-2025,Poland – Repair and maintenance services – Świadczenie usług serwisowania sprzętu medycznego na potrzeby Zakładów i Pracowni Stomatologicznych oraz Klinik Psychiatrycznych Centralnego Szpitala Klinicznego Uniwersytetu Medycznego w Łodzi,Samodzielny Publiczny Zakład Opieki Zdrowotnej Centralny Szpital Kliniczny Uniwersytetu Medycznego w Łodzi,Poland,,2025-06-19,https://ted.europa.eu/en/notice/-/detail/397814-2025,https://platformazakupowa.pl/pn/csk_umed,platformazakupowa,General links
396178-2025,Poland – Repair and maintenance services – Świadczenie usług serwisowania sprzętu medycznego na potrzeby Zakładów i Pracowni Stomatologicznych oraz Klinik Psychiatrycznych Centralnego Szpitala Klinicznego Uniwersytetu Medycznego w Łodzi,Samodzielny Publiczny Zakład Opieki Zdrowotnej Centralny Szpital Kliniczny Uniwersytetu Medycznego w Łodzi,Poland,,2025-06-19,https://ted.europa.eu/en/notice/-/detail/396178-2025,https://platformazakupowa.pl/pn/csk_umed,platformazakupowa,General links
395738-2025,Poland – Medical practice services – KONKURS OFERT NA UDZIELANIE ŚWIADCZEŃ ZDROWOTNYCH,Regionalne Centrum Krwiodawstwa i Krwiolecznictwa w Kaliszu,Poland,,2025-06-19,https://ted.europa.eu/en/notice/-/detail/395738-2025,https://europa.eu/european-union/contact/institutions-bodies_en,unknown_platform_europa.eu,General page scan
398616-2025,"Poland – Laboratory reagents – Dzierżawa analizatorów biochemiczno-immunochemicznych wraz z sukcesywną dostawą odczynników, materiałów kontrolnych, części i materiałów zużywalnych","Dolnośląskie Centrum Onkologii, Pulmonologii i Hematologii",Poland,,2025-06-19,https://ted.europa.eu/en/notice/-/detail/398616-2025,https://dcopih.ezamawiajacy.pl/react/my-procedure/1/203448,ezamawiajacy,General links
398441-2025,Poland – Medical education services – Kompleksowa usługa edukacyjna polegająca na realizacji kursów specjalizacyjnych dla lekarzy uczestniczących w procesie kształcenia specjalizacyjnego,Centrum Medycznego Kształcenia Podyplomowego,Poland,,2025-06-19,https://ted.europa.eu/en/notice/-/detail/398441-2025,https://cmkp.eb2b.com.pl,eb2b,General links
398498-2025,"Poland – Waste-tip management services – Odbiór, transport i odzysk odpadów z Miejskiego Zakładu Gospodarki Odpadami Komunalnymi Sp. z o.o. w Koninie",Miejski Zakład Gospodarki Odpadami Komunalnymi Sp. z o.o. w Koninie,Poland,,2025-06-19,https://ted.europa.eu/en/notice/-/detail/398498-2025,https://mzgok-konin.ezamawiajacy.pl/pn/mzgok-konin/demand/205068/notice/public/details,ezamawiajacy,General links
398716-2025,"Poland – Construction work for electricity power lines – Budowa instalacji OZE działającej w ramach sieci wyspowej tj. off grid (fotowoltaiczna i pionowych turbin wiatrowych) o łącznej nominalnej mocy wyjściowej AC 1,63 MW, z magazynem energii elektrycznej o pojemności 6 MWh i systemem zarządzania energią na terenie bazy MPK w Świdnicy przy ul. Inżynierskiej 6, na potrzeby zabezpieczenia ""zielonej energii"" dla stacji ładowania pojazdów.","Miejskie Przedsiębiorstwo Komunikacyjne ""Świdnica"" spółka z ograniczoną odpowiedzialnością",Poland,2025-07-31 10:00,2025-06-19,https://ted.europa.eu/en/notice/-/detail/398716-2025,https://ezamowienia.gov.pl/mp-client/search/list/ocds-148610-ebc22963-9c94-46a5-8eca-7539edff535a,ezamowienia,General links
398787-2025,Poland – Repair and maintenance services – Świadczenie usług serwisowania sprzętu medycznego na potrzeby Zakładów i Pracowni Stomatologicznych oraz Klinik Psychiatrycznych Centralnego Szpitala Klinicznego Uniwersytetu Medycznego w Łodzi,Samodzielny Publiczny Zakład Opieki Zdrowotnej Centralny Szpital Kliniczny Uniwersytetu Medycznego w Łodzi,Poland,,2025-06-19,https://ted.europa.eu/en/notice/-/detail/398787-2025,https://platformazakupowa.pl/pn/csk_umed,platformazakupowa,General links
397233-2025,Poland – Repair and maintenance services – Świadczenie usług serwisowania sprzętu medycznego na potrzeby Zakładów i Pracowni Stomatologicznych oraz Klinik Psychiatrycznych Centralnego Szpitala Klinicznego Uniwersytetu Medycznego w Łodzi,Samodzielny Publiczny Zakład Opieki Zdrowotnej Centralny Szpital Kliniczny Uniwersytetu Medycznego w Łodzi,Poland,,2025-06-19,https://ted.europa.eu/en/notice/-/detail/397233-2025,https://platformazakupowa.pl/pn/csk_umed,platformazakupowa,General links
397371-2025,Poland – Passenger cars – Najem przez Dolnośląski Ośrodek Ruchu Drogowego do 10 szt. samochodów osobowych niskoemisyjnych lub zeroemisyjnych.,Dolnośląski Ośrodek Ruchu Drogowego,Poland,,2025-06-19,https://ted.europa.eu/en/notice/-/detail/397371-2025,https://europa.eu/european-union/contact/institutions-bodies_en,unknown_platform_europa.eu,General page scan
397474-2025,Poland – Electricity – „Kompleksowa dostawa energii elektrycznej obejmująca sprzedaż energii elektrycznej oraz świadczenie usług przesyłania i dystrybucji energii elektrycznej dla potrzeb oświetlenia ulicznego i jednostek organizacyjnych stanowiących własność Gminy Wyszków”,Gmina Wyszków,Poland,2025-07-24 10:00,2025-06-19,https://ted.europa.eu/en/notice/-/detail/397474-2025,https://wyszkow.ezamawiajacy.pl,ezamawiajacy,General links
397563-2025,Poland – Personal computers – Dostawa sprzętu komputerowego wraz z niezbędnym oprogramowaniem na potrzeby Organów prowadzących szkoły i placówki oświatowe,Centrum Obsługi Administracji Rządowej,"Poland, Poland",2025-07-09 11:00,2025-06-19,https://ted.europa.eu/en/notice/-/detail/397563-2025,https://zamowienia.eb2b.com.pl,eb2b,General links
397743-2025,Poland – Natural gas – WYKONANIE KOMPLEKSOWEJ DOSTAWY GAZU ZIEMNEGO WYSOKOMETANOWEGO TYPU E NA POTRZEBY GRUPY ZAKUPOWEJ GMINY KRAŚNIK,Gmina Kraśnik,Poland,,2025-06-19,https://ted.europa.eu/en/notice/-/detail/397743-2025,https://platformazakupowa.pl/forum/get/topics/for/auction/1054515,platformazakupowa,General links
397949-2025,"Poland – Engineering design services for the construction of civil engineering works – Opracowanie dokumentacji projektowo kosztorysowej dla przebudowy przepustów rurowych, mostków oraz przejazdów brodem na przepusty z dnem naturalnym w Nadleśnictwie Jeleśnia",Państwowe Gospodarstwo Leśne Lasy Państwowe Nadleśnictwo Jeleśnia,Poland,2025-07-15 10:00,2025-06-19,https://ted.europa.eu/en/notice/-/detail/397949-2025,https://europa.eu/european-union/contact/institutions-bodies_en,unknown_platform_europa.eu,General page scan
398020-2025,Poland – Meal-cooking services – Świadczenie usługi całodziennego kompleksowego żywienia pacjentów Powiatowego Szpitala im. Władysława Biegańskiego w Iławie,Powiatowy Szpital im. Władysława Biegańskiego w Iławie,Poland,,2025-06-19,https://ted.europa.eu/en/notice/-/detail/398020-2025,https://europa.eu/european-union/contact/institutions-bodies_en,unknown_platform_europa.eu,General page scan
398180-2025,Poland – Security services – Usługa ochrony fizycznej stałej - dozoru mienia nieruchomości Specjalistycznego Szpitala Wojewódzkiego w Ciechanowie w Szpitalnym Oddziale Ratunkowym oraz Nocnej i Świątecznej Opiece Zdrowotnej,SPECJALISTYCZNY SZPITAL WOJEWÓDZKI W CIECHANOWIE,Poland,,2025-06-19,https://ted.europa.eu/en/notice/-/detail/398180-2025,https://europa.eu/european-union/contact/institutions-bodies_en,unknown_platform_europa.eu,General page scan
398356-2025,"Poland – Laboratory reagents – Dostawa testów do typowania/genotypowania, kontrole limfocytotoksyczne, odczynniki do barwień, odczynniki do oceny ddcfDNA, materiałów zużywalnych do spektrometru gazowego dla UCKWUM na okres 24 oraz 12 miesięcy",Uniwersyteckie Centrum Kliniczne Warszawskiego Uniwersytetu Medycznego,Poland,,2025-06-19,https://ted.europa.eu/en/notice/-/detail/398356-2025,https://uckwum.ezamawiajacy.pl,ezamawiajacy,General links
398313-2025,Poland – Laboratory pipettes and accessories – Sukcesywne dostawy materiałów laboratoryjnych zużywalnych i drobnego sprzętu laboratoryjnego dla jednostek organizacyjnych Śląskiego Uniwersytetu Medycznego w Katowicach przez okres 24 miesięcy,Śląski Uniwersytet Medyczny w Katowicach,Poland,,2025-06-19,https://ted.europa.eu/en/notice/-/detail/398313-2025,https://sum.eb2b.com.pl,eb2b,General links
398257-2025,Poland – Pharmaceutical products – dostawy leków w ramach programów lekowych,"5. Wojskowy Szpital Kliniczny z Polikliniką, Samodzielny Publiczny Zakład Opieki Zdrowotnej",Poland,,2025-06-19,https://ted.europa.eu/en/notice/-/detail/398257-2025,https://europa.eu/european-union/contact/institutions-bodies_en,unknown_platform_europa.eu,General page scan
397409-2025,Poland – Pharmaceutical products – Dostawa programu lekowego (Secukinumabum),Uniwersytecki Szpital Dziecięcy w Krakowie,Poland,,2025-06-19,https://ted.europa.eu/en/notice/-/detail/397409-2025,https://usdk.eb2b.com.pl,eb2b,General links
397508-2025,Poland – Repair and maintenance services – Świadczenie usług serwisowania sprzętu medycznego na potrzeby Zakładów i Pracowni Stomatologicznych oraz Klinik Psychiatrycznych Centralnego Szpitala Klinicznego Uniwersytetu Medycznego w Łodzi,Samodzielny Publiczny Zakład Opieki Zdrowotnej Centralny Szpital Kliniczny Uniwersytetu Medycznego w Łodzi,Poland,,2025-06-19,https://ted.europa.eu/en/notice/-/detail/397508-2025,https://platformazakupowa.pl/pn/csk_umed,platformazakupowa,General links
398626-2025,Poland – Financial and insurance services – Usługa pośrednictwa finansowego w zakresie wdrażania Produktu Finansowego – Pożyczka Uniwersalna II,Zachodniopomorska Agencja Rozwoju Regionalnego S.A.,Poland,,2025-06-19,https://ted.europa.eu/en/notice/-/detail/398626-2025,https://portal.smartpzp.pl/zarr,smartpzp,General links
396579-2025,Poland – Professional services for the gas industry – PRZEGLĄDY SYSTEMÓW STEROWANIA I AUTOMATYKI PRZEMYSŁOWEJ W KPMG MOGILNO,Gas Storage Poland sp. z o.o.,Poland,2025-07-23 12:00,2025-06-19,https://ted.europa.eu/en/notice/-/detail/396579-2025,https://gsp.eb2b.com.pl/open-auctions.html,eb2b,General links
396787-2025,Poland – Repair and maintenance services – Świadczenie usług serwisowania sprzętu medycznego na potrzeby Zakładów i Pracowni Stomatologicznych oraz Klinik Psychiatrycznych Centralnego Szpitala Klinicznego Uniwersytetu Medycznego w Łodzi,Samodzielny Publiczny Zakład Opieki Zdrowotnej Centralny Szpital Kliniczny Uniwersytetu Medycznego w Łodzi,Poland,,2025-06-19,https://ted.europa.eu/en/notice/-/detail/396787-2025,https://platformazakupowa.pl/pn/csk_umed,platformazakupowa,General links
397000-2025,Poland – Cleaning services – Świadczenie usług sprzątania w Izbie Administracji Skarbowej w Olsztynie i w podległych jednostkach oraz wykonywanie prac konserwacyjnych i naprawczych,Izba Administracji Skarbowej w Olsztynie,Poland,,2025-06-19,https://ted.europa.eu/en/notice/-/detail/397000-2025,https://ias-olsztyn.ezamawiajacy.pl,ezamawiajacy,General links
397201-2025,Poland – Medical hospital services – 1. Udzielanie świadczeń zdrowotnych z zakresu chorób zakaźnych w Śląskim Centrum Chorób Zakaźnych w trakcie zwykłej ordynacji czasu pracy oraz dyżurów medycznych. 2. Udzielanie świadczeń zdrowotnych z zakresu chorób zakaźnych w Poradniach Śląskiego Centrum Chorób Zakaźnych.,Górnośląskie Centrum Medyczne im. prof. Leszka Gieca Śląskiego Uniwersytetu Medycznego w Katowicach,Poland,,2025-06-19,https://ted.europa.eu/en/notice/-/detail/397201-2025,https://europa.eu/european-union/contact/institutions-bodies_en,unknown_platform_europa.eu,General page scan
397343-2025,Poland – Repair and maintenance services – Świadczenie usług serwisowania sprzętu medycznego na potrzeby Zakładów i Pracowni Stomatologicznych oraz Klinik Psychiatrycznych Centralnego Szpitala Klinicznego Uniwersytetu Medycznego w Łodzi,Samodzielny Publiczny Zakład Opieki Zdrowotnej Centralny Szpital Kliniczny Uniwersytetu Medycznego w Łodzi,Poland,,2025-06-19,https://ted.europa.eu/en/notice/-/detail/397343-2025,https://platformazakupowa.pl/pn/csk_umed,platformazakupowa,General links
397051-2025,Poland – Computer equipment and supplies – Dostawa sprzętu komputerowego na potrzeby Wojewódzkiego Szpitala Specjalistycznego dla Nerwowo i Psychicznie Chorych SP ZOZ w Ciborzu,Wojewódzki Szpital Specjalistyczny dla Nerwowo i Psychicznie Chorych SP ZOZ w Ciborzu,Poland,2025-06-24 10:00,2025-06-19,https://ted.europa.eu/en/notice/-/detail/397051-2025,https://platformazakupowa.pl/pn/ciborz,platformazakupowa,General links
