tender_id,name,organization,location,submission_deadline,initiation_date,details_url,original_source_url,original_source_type,found_in_section
401621-2025,"Poland – Various medicinal products – Dostawa produktów leczniczych, leków do programów lekowych i chemioterapii dla USK-1 w Szczecinie",Uniwersytecki Szpital Kliniczny nr 1 im. prof. Tadeusza Sokołowskiego PUM w Szczecinie,Poland,2025-07-24 08:00,2025-06-20,https://ted.europa.eu/en/notice/-/detail/401621-2025,https://ezamowienia.gov.pl/mp-client/search/list/ocds-148610-bdde0f55-0b50-431b-856b-2edb1968dfd8,ezamowienia,General links
399556-2025,Poland – General management consultancy services – Usługa doradcza dotycząca opracowania strategii działania i rozwoju ARP S.A. uwzględniająca cele ESG oraz wdrożenie sprawozdawczości zrównoważonego rozwoju,AGENCJA ROZWOJU PRZEMYSŁU SPÓŁKA AKCYJNA,Poland,2025-06-27 12:00,2025-06-20,https://ted.europa.eu/en/notice/-/detail/399556-2025,https://europa.eu/european-union/contact/institutions-bodies_en,unknown_platform_europa.eu,General page scan
399837-2025,"Poland – Archaeological services – Wykonanie archeologicznych badań wykopaliskowych na trasie planowanej do budowy drogi ekspresowej S74 wraz z opracowaniem wyników badań, z podziałem na dwie części",Generalna Dyrekcja Dróg Krajowych i Autostrad,Poland,2025-07-15 09:00,2025-06-20,https://ted.europa.eu/en/notice/-/detail/399837-2025,https://gddkia.eb2b.com.pl,eb2b,General links
399956-2025,Poland – Electricity distribution – Dystrybucja energii elektrycznej do budynku Sądu Rejonowego dla Łodzi-Śródmieścia w Łodzi przy ulicy Wojska Polskiego 180 (zasilanie podstawowe),Sąd Rejonowy dla Łodzi-Śródmieścia w Łodzi,Poland,,2025-06-20,https://ted.europa.eu/en/notice/-/detail/399956-2025,https://europa.eu/european-union/contact/institutions-bodies_en,unknown_platform_europa.eu,General page scan
400298-2025,Poland – Magnetic resonance unit – DOSTAWA SPRZĘTU MEDYCZNEGO - REZONANS MAGNETYCZNY 3 T DLA SZPITALA ZACHODNIEGO W GRODZISKU MAZOWIECKIM.,Samodzielny Publiczny Specjalistyczny Szpital Zachodni im. św. Jana Pawła II w Grodzisku Mazowieckim,Poland,2025-07-03 10:00,2025-06-20,https://ted.europa.eu/en/notice/-/detail/400298-2025,https://platformazakupowa.pl/pn/szpitalzachodni/proceedings,platformazakupowa,General links
400315-2025,Poland – Laboratory reagents – Dostawa odczynników wraz z dzierżawą na okres 24 miesięcy,Uniwersytecki Szpital Kliniczny w Białymstoku,Poland,,2025-06-20,https://ted.europa.eu/en/notice/-/detail/400315-2025,https://europa.eu/european-union/contact/institutions-bodies_en,unknown_platform_europa.eu,General page scan
400935-2025,Poland – Industrial machinery – Dostawa układu separacji powietrznej,Łużyckie Centrum Recyklingu Spółka z ograniczoną odpowiedzialnością,Poland,,2025-06-20,https://ted.europa.eu/en/notice/-/detail/400935-2025,https://platformazakupowa.pl/pn/zzo_marszow,platformazakupowa,General links
400855-2025,Poland – Damage or loss insurance services – Ubezpieczenie mienia Warszawskiej Wytwórni Energii (WWE),Miejskie Przedsiębiorstwo Oczyszczania w m. st. Warszawie sp. z o.o.,Poland,2025-06-27 11:00,2025-06-20,https://ted.europa.eu/en/notice/-/detail/400855-2025,https://op.europa.eu,unknown_platform_op.europa.eu,Warunki udzielenia zamówienia
400752-2025,Poland – Firefighting vehicles – Dostawa fabrycznie nowego ciężkiego samochodu ratowniczo-gaśniczego dla Ochotniczej Straży Pożarnej w Puszczykowie,OCHOTNICZA STRAŻ POŻARNA W PUSZCZYKOWIE,Poland,2025-08-01 09:00,2025-06-20,https://ted.europa.eu/en/notice/-/detail/400752-2025,https://platformazakupowa.pl/pn/puszczykowo,platformazakupowa,General links
401106-2025,Poland – Cleaning services – Świadczenie usługi utrzymania czystości i porządku w budynkach mieszkalnych i użytkowych oraz na terenach będących w zasobie Agencji Mienia Wojskowego Oddział Regionalny w Lublinie.,Agencja Mienia Wojskowego,Poland,,2025-06-20,https://ted.europa.eu/en/notice/-/detail/401106-2025,https://amw.ezamawiajacy.pl,ezamawiajacy,General links
401103-2025,"Poland – Software package and information systems – Dostawa subskrypcji na licencje uprawniające do instalacji i użytkowania przez okres 36 miesięcy pakietu oprogramowania Office 365 w planie A3, dla 3760 Pracowników Uniwersytetu Łódzkiego oraz licencji dodatkowych",Uniwersytet Łódzki,Poland,2025-07-04 13:00,2025-06-20,https://ted.europa.eu/en/notice/-/detail/401103-2025,https://platformazakupowa.pl/transakcja/1128741,platformazakupowa,General links
401075-2025,"Poland – Optical instruments – Dostawy sprzętu laboratoryjnego: Sprzedaż, dostawa, instalacja oraz uruchomienie laminaru embriologicznego KPO23",Międzynarodowy Instytut Biologii Molekularnej i Komórkowej w Warszawie,Poland,2025-07-29 12:00,2025-06-20,https://ted.europa.eu/en/notice/-/detail/401075-2025,https://platformazakupowa.pl/transakcja/1124749,platformazakupowa,General links
401219-2025,"Poland – IT services: consulting, software development, Internet and support – Świadczenie Usług Utrzymania Platformy e-Zamówienia",URZĄD ZAMÓWIEŃ PUBLICZNYCH,Poland,2025-07-04 10:00,2025-06-20,https://ted.europa.eu/en/notice/-/detail/401219-2025,https://ezamowienia.gov.pl,ezamowienia,Warunki udzielenia zamówienia
400420-2025,Poland – Medical equipments – Dostawa zestawów narzędzi chirurgicznych do zabiegów dla Poradni Specjalistycznej SPSK im prof. A. Grucy CMKP w Otwocku,Samodzielny Publiczny Szpital Kliniczny im. Prof. A. Grucy CMKP,Poland,2025-07-01 09:45,2025-06-20,https://ted.europa.eu/en/notice/-/detail/400420-2025,https://spskgruca.ezamawiajacy.pl/servlet/HomeServlet,ezamawiajacy,General links
400846-2025,Poland – Repair and maintenance services of cooler groups – Wykonanie przeglądów rocznych klimatyzacji w pojazdach kolejowych,POLREGIO S.A.,Poland,2025-07-24 11:00,2025-06-20,https://ted.europa.eu/en/notice/-/detail/400846-2025,https://polregio.eb2b.com.pl,eb2b,General links
400929-2025,Poland – Tablet computer – Zakup tabletów z elementami dodatkowymi,Pomorski Uniwersytet Medyczny w Szczecinie,Poland,2025-07-04 12:00,2025-06-20,https://ted.europa.eu/en/notice/-/detail/400929-2025,https://platformazakupowa.pl/strona/45-instrukcje,platformazakupowa,General links
401012-2025,"Poland – Repair and maintenance services of medical equipment – ZP 14/25 Przeglądy, naprawy sprzętu i aparatury medycznej",Wojewódzki Specjalistyczny Szpital im. dr Wł. Biegańskiego w Łodzi,Poland,2025-07-01 08:00,2025-06-20,https://ted.europa.eu/en/notice/-/detail/401012-2025,https://www.platformazakupowa.pl/pn/szpital_bieganskiego,platformazakupowa,General links
400784-2025,Poland – Vehicles for the emergency services – Zakup i dostawa nowego ciężkiego samochodu ratowniczo-gaśniczego z napędem 4x4 wraz z wyposażeniem dla Ochotniczej Straży Pożarnej w Starych Juchach,OCHOTNICZA STRAŻ POŻARNA W STARYCH JUCHACH,Poland,2025-07-24 11:00,2025-06-20,https://ted.europa.eu/en/notice/-/detail/400784-2025,https://ezamowienia.gov.pl/mp-client/tenders/ocds-148610-a5a1e4e7-dd1b-11ee-8305-7e4937eb936d,ezamowienia,General links
401477-2025,"Poland – Architectural, engineering and planning services – Wykonanie dokumentacji projektowo-kosztorysowej wraz z uzyskaniem pozwolenia na budowę dla zadania pn. ""Odbudowa zbiornika wodnego w leśnictwie Zadobrze""",Nadleśnictwo Radom,Poland,2025-06-27 10:00,2025-06-20,https://ted.europa.eu/en/notice/-/detail/401477-2025,https://platformazakupowa.pl/transakcja/1119083,platformazakupowa,General links
401481-2025,Poland – Agricultural machinery – Dostawa maszyn rolniczych,Centralny Ośrodek Badania Odmian Roślin Uprawnych Stacja Doświadczalna Oceny Odmian w Przecławiu,Poland,2025-07-24 10:00,2025-06-20,https://ted.europa.eu/en/notice/-/detail/401481-2025,https://ezamowienia.gov.pl/mp-client/search/list/ocds-148610-72be1a49-ba86-4fa4-9b49-93620cf7f4b5,ezamowienia,General links
401568-2025,Poland – Network equipment – Dostawa urządzeń sieciowych niezbędnych do wprowadzenia Dyrektywy Unijnej NIS2,Uniwersytet Przyrodniczy we Wrocławiu,Poland,2025-07-15 10:00,2025-06-20,https://ted.europa.eu/en/notice/-/detail/401568-2025,https://europa.eu/european-union/contact/institutions-bodies_en,unknown_platform_europa.eu,General page scan
398807-2025,Poland – Medical consumables – dostawy materiałów medycznych jednorazowego użytku,"5. Wojskowy Szpital Kliniczny z Polikliniką, Samodzielny Publiczny Zakład Opieki Zdrowotnej",Poland,,2025-06-19,https://ted.europa.eu/en/notice/-/detail/398807-2025,https://europa.eu/european-union/contact/institutions-bodies_en,unknown_platform_europa.eu,General page scan
397345-2025,Poland – Advertising material – sukcesywna dostawa materiałów promocyjnych na potrzeby Centrum Rekrutacji AGH - DE-dzp.272-731/24,Akademia Górniczo-Hutnicza im. Stanisława Staszica w Krakowie,Poland,,2025-06-19,https://ted.europa.eu/en/notice/-/detail/397345-2025,https://europa.eu/european-union/contact/institutions-bodies_en,unknown_platform_europa.eu,General page scan
397613-2025,"Poland – Building services – Świadczenie usług pogotowia technicznego, usuwania awarii i robót konserwacyjno-naprawczych w budynkach Skarbu Państwa AMW w zasobach AMW OReg Bydgoszcz.",Agencja Mienia Wojskowego,Poland,,2025-06-19,https://ted.europa.eu/en/notice/-/detail/397613-2025,https://amw.ezamawiajacy.pl,ezamawiajacy,General links
397618-2025,Poland – Parking meters – Sukcesywna dostawa fabrycznie nowych części zamiennych do parkomatów firmy PARKEON model STRADA PAL oraz model STRADA EVOLUTION-2,Zarząd Dróg Miasta Krakowa,Poland,,2025-06-19,https://ted.europa.eu/en/notice/-/detail/397618-2025,https://platformazakupowa.pl/pn/zdmk.krakow,platformazakupowa,General links
397699-2025,Poland – Vehicles for refuse – Zakup dwóch fabrycznie nowych pojazdów specjalistycznych typu śmieciarka jednokomorowa o DMC 26 ton dla Zakładu Oczyszczania Miasta Mysłowice,Zakład Oczyszczania Miasta sp. z o.o. z siedzibą w Mysłowicach,Poland,,2025-06-19,https://ted.europa.eu/en/notice/-/detail/397699-2025,https://ezamowienia.gov.pl/pl,ezamowienia,General links
397807-2025,Poland – Pharmaceutical products – Dostawa opatrunków,Uniwersytecki Szpital Dziecięcy w Krakowie,Poland,,2025-06-19,https://ted.europa.eu/en/notice/-/detail/397807-2025,https://usdk.eb2b.com.pl,eb2b,General links
398358-2025,Poland – Repair and maintenance services – Świadczenie usług serwisowania sprzętu medycznego na potrzeby Zakładów i Pracowni Stomatologicznych oraz Klinik Psychiatrycznych Centralnego Szpitala Klinicznego Uniwersytetu Medycznego w Łodzi,Samodzielny Publiczny Zakład Opieki Zdrowotnej Centralny Szpital Kliniczny Uniwersytetu Medycznego w Łodzi,Poland,,2025-06-19,https://ted.europa.eu/en/notice/-/detail/398358-2025,https://platformazakupowa.pl/pn/csk_umed,platformazakupowa,General links
398411-2025,Poland – Transport services (excl. Waste transport) – Świadczenie usług w zakresie przewozów autobusowych w publicznym transporcie zbiorowym na liniach komunikacyjnych organizowanych przez Wójta Gminy Zabierzów: Część I: Linia GZ2.1: Zabierzów Młyn-Kraków Airport Część II: Linia GZ3: Krzeszowice D.A. – Zabierzów Młyn Część III: Linia GZ4: Zabierzów Młyn – Brzoskwinia Pętla,Gmina Zabierzów,Poland,2025-07-03 10:00,2025-06-19,https://ted.europa.eu/en/notice/-/detail/398411-2025,https://ezamowienia.gov.pl/mp-client/search/list/ocds-148610-57252409-4bd6-4cad-b005-14a4f0ffce5a,ezamowienia,General links
398537-2025,Poland – Personal computers – Sukcesywna dostawa sprzętu komputerowego,Uniwersytet Śląski w Katowicach,Poland,,2025-06-19,https://ted.europa.eu/en/notice/-/detail/398537-2025,https://us.ezamawiajacy.pl,ezamawiajacy,General links
398617-2025,Poland – Repair and maintenance services – Świadczenie usług serwisowania sprzętu medycznego na potrzeby Zakładów i Pracowni Stomatologicznych oraz Klinik Psychiatrycznych Centralnego Szpitala Klinicznego Uniwersytetu Medycznego w Łodzi,Samodzielny Publiczny Zakład Opieki Zdrowotnej Centralny Szpital Kliniczny Uniwersytetu Medycznego w Łodzi,Poland,,2025-06-19,https://ted.europa.eu/en/notice/-/detail/398617-2025,https://platformazakupowa.pl/pn/csk_umed,platformazakupowa,General links
398619-2025,Poland – Chemical reagents – Sukcesywna dostawa odczynników chemicznych,Uniwersytet Śląski w Katowicach,Poland,,2025-06-19,https://ted.europa.eu/en/notice/-/detail/398619-2025,https://us.ezamawiajacy.pl,ezamawiajacy,General links
398620-2025,Poland – Miscellaneous medical devices and products – PN 40/25 Dostawa specjalistycznego sprzętu medycznego,Wojewódzki Szpital Specjalistyczny im. J. Gromkowskiego,Poland,2025-06-24 10:00,2025-06-19,https://ted.europa.eu/en/notice/-/detail/398620-2025,https://platformazakupowa.pl/pn/szpital_gromkowskiego,platformazakupowa,General links
397817-2025,Poland – Construction work – Modernizacja stacji 220 / 110 kV Łośnice,Polskie Sieci Elektroenergetyczne Spółka Akcyjna,Poland,2025-07-17 12:00,2025-06-19,https://ted.europa.eu/en/notice/-/detail/397817-2025,https://europa.eu/european-union/contact/institutions-bodies_en,unknown_platform_europa.eu,General page scan
397346-2025,"Poland – Medical consumables – dostawy materiałów medycznych jednorazowego użytku - p. 4,9,21,29,38","5. Wojskowy Szpital Kliniczny z Polikliniką, Samodzielny Publiczny Zakład Opieki Zdrowotnej",Poland,,2025-06-19,https://ted.europa.eu/en/notice/-/detail/397346-2025,https://europa.eu/european-union/contact/institutions-bodies_en,unknown_platform_europa.eu,General page scan
398686-2025,Poland – Laboratory reagents – Dostawa odczynników do diagnostyki laboratoryjnej wraz z dzierżawą aparatów dla Powiatowego Centrum Zdrowia sp. z o.o. z siedzibą w Opolu Lubelskim przy ul. Przemysłowej 4 a. numer: P.ZM.381.6.2025,Powiatowe Centrum Zdrowia sp. z.o.o.,Poland,2025-07-28 08:00,2025-06-19,https://ted.europa.eu/en/notice/-/detail/398686-2025,http://pczol.ezamawiajacy.pl,ezamawiajacy,General links
396853-2025,Poland – Repair and maintenance services – Świadczenie usług serwisowania sprzętu medycznego na potrzeby Zakładów i Pracowni Stomatologicznych oraz Klinik Psychiatrycznych Centralnego Szpitala Klinicznego Uniwersytetu Medycznego w Łodzi,Samodzielny Publiczny Zakład Opieki Zdrowotnej Centralny Szpital Kliniczny Uniwersytetu Medycznego w Łodzi,Poland,,2025-06-19,https://ted.europa.eu/en/notice/-/detail/396853-2025,https://platformazakupowa.pl/pn/csk_umed,platformazakupowa,General links
397020-2025,Poland – Parts of military vehicles – Części do pojazdów bojowych,Open Nexus sp. z o.o.,Poland,2025-07-30 11:00,2025-06-19,https://ted.europa.eu/en/notice/-/detail/397020-2025,https://platformazakupowa.pl/pn/opennexus,platformazakupowa,General links
396990-2025,Poland – Passenger cars – Dostawy samochodów osobowych w policyjnej wersji nieoznakowany dla jednostek organizacyjnych Policji (5 zadań częściowych),KOMENDA WOJEWÓDZKA POLICJI W OLSZTYNIE,Poland,2025-07-17 09:00,2025-06-19,https://ted.europa.eu/en/notice/-/detail/396990-2025,http://www.ezamowienia.gov.pl,ezamowienia,General links
397019-2025,"Poland – Venepuncture, blood sampling devices – Dostawy materiałów medycznych do pobierania krwi",Samodzielny Publiczny Zakład Opieki Zdrowotnej Wojewódzki Szpital Specjalistyczny Nr 3 w Rybniku,Poland,,2025-06-19,https://ted.europa.eu/en/notice/-/detail/397019-2025,https://platformazakupowa.pl/pn/szpital.rybnik,platformazakupowa,General links
397337-2025,Poland – Pharmaceutical products – Dostawa Treprostynilum (program lekowy),Uniwersytecki Szpital Dziecięcy w Krakowie,Poland,,2025-06-19,https://ted.europa.eu/en/notice/-/detail/397337-2025,https://usdk.eb2b.com.pl,eb2b,General links
397076-2025,Poland – Credit granting services – Udzielenie kredytu długoterminowego do wysokości 12 401 168 zł,Gmina Stegna,Poland,2025-07-24 09:00,2025-06-19,https://ted.europa.eu/en/notice/-/detail/397076-2025,https://platformazakupowa.pl/pn/stegna/proceedings,platformazakupowa,General links
397075-2025,Poland – Electricity – Dostawa energii elektrycznej dla obiektów wojskowych w rejonie działania RZI Gdynia-2025 r.,Rejonowy Zarząd Infrastruktury w Gdyni,Poland,2025-06-30 12:00,2025-06-19,https://ted.europa.eu/en/notice/-/detail/397075-2025,https://platformazakupowa.pl/transakcja/1117499,platformazakupowa,General links
395613-2025,Poland – Miscellaneous computer equipment – Sukcesywna dostawa sprzętu komputerowego ZK-DZP.262.15.2025,Politechnika Białostocka,Poland,,2025-06-19,https://ted.europa.eu/en/notice/-/detail/395613-2025,https://pb.ezamawiajacy.pl,ezamawiajacy,General links
395630-2025,Poland – Repair and maintenance services – Świadczenie usług serwisowania sprzętu medycznego na potrzeby Zakładów i Pracowni Stomatologicznych oraz Klinik Psychiatrycznych Centralnego Szpitala Klinicznego Uniwersytetu Medycznego w Łodzi,Samodzielny Publiczny Zakład Opieki Zdrowotnej Centralny Szpital Kliniczny Uniwersytetu Medycznego w Łodzi,Poland,,2025-06-19,https://ted.europa.eu/en/notice/-/detail/395630-2025,https://platformazakupowa.pl/pn/csk_umed,platformazakupowa,General links
396079-2025,Poland – Medical education services – Kompleksowa usługa edukacyjna polegająca na realizacji kursów specjalizacyjnych dla lekarzy uczestniczących w procesie kształcenia specjalizacyjnego,Centrum Medycznego Kształcenia Podyplomowego,Poland,,2025-06-19,https://ted.europa.eu/en/notice/-/detail/396079-2025,https://cmkp.eb2b.com.pl,eb2b,General links
396005-2025,Poland – Pharmaceutical products – Sukcesywna dostawa produktów leczniczych na potrzeby niekomercyjnego eksperymentu badawczego w ramach projektu „Randomizowane badanie porównujące skuteczność endoskopowej plastyki żołądka z małoinwazyjną operacją bariatryczną lub leczeniem zachowawczym u chorych z otyłością i chorobami towarzyszącymi”.,Warszawski Uniwersytet Medyczny,Poland,2025-07-18 11:00,2025-06-19,https://ted.europa.eu/en/notice/-/detail/396005-2025,https://wum.ezamawiajacy.pl,ezamawiajacy,General links
397130-2025,Poland – Social research services – ZP.262.3.2025.MSD Realizacja i opracowanie badania „Dobre praktyki aktywizacji zawodowej imigrantów na terenie województwa lubelskiego oraz integracji na lokalnych rynkach pracy cudzoziemców o zróżnicowanych kwalifikacjach” dla Wojewódzkiego Urzędu Pracy w Lublinie w ramach projektu pt. „Lubelskie Obserwatorium Rynku Pracy I”,Wojewódzki Urząd Pracy w Lublinie,Poland,,2025-06-19,https://ted.europa.eu/en/notice/-/detail/397130-2025,https://europa.eu/european-union/contact/institutions-bodies_en,unknown_platform_europa.eu,General page scan
397306-2025,Poland – Environmental monitoring other than for construction – Wykonanie monitoringów przedmiotów ochrony obszarów Natura 2000 realizowane przez RDOŚ w Łodzi – postępowanie w podziale na 6 części,Regionalna Dyrekcja Ochrony Środowiska w Łodzi,Poland,,2025-06-19,https://ted.europa.eu/en/notice/-/detail/397306-2025,https://ezamowienia.gov.pl/pl,ezamowienia,General links
397292-2025,Poland – Firefighting vehicles – Wyposażenie jednostki Lotniskowej Służby Ratowniczo- Gaśniczej Rzeszów- Jasionka w dwa samochody ratowniczo- gaśnicze,Port Lotniczy Rzeszów - Jasionka im. Rodziny Ulmów Sp. z o.o.,Poland,,2025-06-19,https://ted.europa.eu/en/notice/-/detail/397292-2025,https://platformazakupowa.pl/pn/rzeszowairport,platformazakupowa,General links
396838-2025,Poland – Firefighting vehicles – Zakup średniego samochodu ratowniczo – gaśniczego dla OSP w Sokołowie Małopolskim,GMINA SOKOŁÓW MAŁOPOLSKI,Poland,2025-06-27 12:00,2025-06-19,https://ted.europa.eu/en/notice/-/detail/396838-2025,https://ezamowienia.gov.pl/mp-client/tenders/ocds-148610-c74ccb01-c78c-4f12-8153-1d0566ca1c37,ezamowienia,General links
396939-2025,Poland – Repair and maintenance services of transformers – Naprawa uszkodzonego transformatora 115/22kV o mocy 25MVA o numerze fabrycznym 48555 - 3/2025/RZ2,TAURON Dystrybucja S.A. Oddział w Legnicy,Poland,,2025-06-19,https://ted.europa.eu/en/notice/-/detail/396939-2025,https://europa.eu/european-union/contact/institutions-bodies_en,unknown_platform_europa.eu,General page scan
397039-2025,Poland – Teaching equipment – Dostawa wyposażenia dla II Liceum Ogólnokształcącego im. Marii Skłodowskiej-Curie w Sanoku w ramach projektu „Poprawa warunków kształcenia ogólnego w Powiecie Sanockim”,Powiat Sanocki,Poland,2025-07-07 12:00,2025-06-19,https://ted.europa.eu/en/notice/-/detail/397039-2025,https://ezamowienia.gov.pl/mp-client/search/list/ocds-148610-4ff0344f-56a8-4598-a887-93f0a912021d,ezamowienia,General links
397244-2025,"Poland – Laboratory reagents – Dostawa odczynników, kalibratorów, akcesoriów wraz z dzierżawą aparatów dla Zakładu Analityki Medycznej oraz Zakładu Mikrobiologii SPZOZ w Sanoku",SAMODZIELNY PUBLICZNY ZESPÓŁ OPIEKI ZDROWOTNEJ W SANOKU,Poland,,2025-06-19,https://ted.europa.eu/en/notice/-/detail/397244-2025,https://ezamowienia.gov.pl,ezamowienia,General links
397379-2025,Poland – Road-maintenance vehicles – ZAKUP WRAZ Z DOSTAWĄ SZEŚCIU ZAMIATAREK CHODNIKOWO - ULICZNYCH DLA ZAKŁADU GOSPODARKI KOMUNALNEJ SP. Z O.O. Z PODZIAŁEM NA DWA ZADANIA,Zakład Gospodarki Komunalnej Sp. z o.o.,Poland,2025-07-22 12:30,2025-06-19,https://ted.europa.eu/en/notice/-/detail/397379-2025,https://europa.eu/european-union/contact/institutions-bodies_en,unknown_platform_europa.eu,Warunki udzielenia zamówienia
397374-2025,Poland – Engineering design services for the construction of civil engineering works – Opracowanie dokumentacji projektowo kosztorysowej budowy brodów w Nadleśnictwie Jeleśnia,Państwowe Gospodarstwo Leśne Lasy Państwowe Nadleśnictwo Jeleśnia,Poland,2025-07-22 11:00,2025-06-19,https://ted.europa.eu/en/notice/-/detail/397374-2025,https://europa.eu/european-union/contact/institutions-bodies_en,unknown_platform_europa.eu,General page scan
396635-2025,Poland – Firefighting vehicles – Zakup średniego samochodu ratowniczo-gaśniczego z napędem 4x4 dla Ochotniczej Straży Pożarnej w Świeszynie na rzecz Pomorza Zachodniego,OCHOTNICZA STRAŻ POŻARNA W ŚWIESZYNIE,Poland,2025-07-03 11:00,2025-06-19,https://ted.europa.eu/en/notice/-/detail/396635-2025,https://platformazakupowa.pl/transakcja/1115819,platformazakupowa,General links
396263-2025,Poland – Repair and maintenance services – Świadczenie usług serwisowania sprzętu medycznego na potrzeby Zakładów i Pracowni Stomatologicznych oraz Klinik Psychiatrycznych Centralnego Szpitala Klinicznego Uniwersytetu Medycznego w Łodzi,Samodzielny Publiczny Zakład Opieki Zdrowotnej Centralny Szpital Kliniczny Uniwersytetu Medycznego w Łodzi,Poland,,2025-06-19,https://ted.europa.eu/en/notice/-/detail/396263-2025,https://platformazakupowa.pl/pn/csk_umed,platformazakupowa,General links
396298-2025,Poland – Vehicles for refuse – „Dostawa pojazdu na podwoziu trzyosiowym z nadwoziem dwukomorowym do odbioru odpadów komunalnych”.,Przedsiębiorstwo Gospodarki Komunalnej Spółka z o.o. w Koszalinie,Poland,2025-07-21 08:00,2025-06-19,https://ted.europa.eu/en/notice/-/detail/396298-2025,https://platformazakupowa.pl/transakcja/1126941Uwaga!Wyci,platformazakupowa,General links
395602-2025,Poland – Repair and maintenance services – Świadczenie usług serwisowania sprzętu medycznego na potrzeby Zakładów i Pracowni Stomatologicznych oraz Klinik Psychiatrycznych Centralnego Szpitala Klinicznego Uniwersytetu Medycznego w Łodzi,Samodzielny Publiczny Zakład Opieki Zdrowotnej Centralny Szpital Kliniczny Uniwersytetu Medycznego w Łodzi,Poland,,2025-06-19,https://ted.europa.eu/en/notice/-/detail/395602-2025,https://platformazakupowa.pl/pn/csk_umed,platformazakupowa,General links
395860-2025,Poland – Repair and maintenance services – Świadczenie usług serwisowania sprzętu medycznego na potrzeby Zakładów i Pracowni Stomatologicznych oraz Klinik Psychiatrycznych Centralnego Szpitala Klinicznego Uniwersytetu Medycznego w Łodzi,Samodzielny Publiczny Zakład Opieki Zdrowotnej Centralny Szpital Kliniczny Uniwersytetu Medycznego w Łodzi,Poland,,2025-06-19,https://ted.europa.eu/en/notice/-/detail/395860-2025,https://platformazakupowa.pl/pn/csk_umed,platformazakupowa,General links
396003-2025,Poland – Repair and maintenance services – Świadczenie usług serwisowania sprzętu medycznego na potrzeby Zakładów i Pracowni Stomatologicznych oraz Klinik Psychiatrycznych Centralnego Szpitala Klinicznego Uniwersytetu Medycznego w Łodzi,Samodzielny Publiczny Zakład Opieki Zdrowotnej Centralny Szpital Kliniczny Uniwersytetu Medycznego w Łodzi,Poland,,2025-06-19,https://ted.europa.eu/en/notice/-/detail/396003-2025,https://platformazakupowa.pl/pn/csk_umed,platformazakupowa,General links
396280-2025,"Poland – IT software development services – Usługa wdrożenia systemu informatycznego klasy ERP wraz z udzieleniem licencji, świadczeniem usługi nadzoru autorskiego i serwisu oraz szkoleniem użytkowników,",Wojewódzki Szpital Specjalistyczny we Wrocławiu,Poland,,2025-06-19,https://ted.europa.eu/en/notice/-/detail/396280-2025,https://www.platformazakupowa.pl/pn/wssk_wroclaw,platformazakupowa,General links
396478-2025,Poland – Vehicles for refuse – Dostawa śmieciarki z zabudową o poj. min. 16 m3 z dźwigiem typu HDS i zasobnikiem min. 5m3 do obsługi pojemników półpodziemnych,Zakład Utylizacji Odpadów Sp. z o. o.,Poland,2025-07-24 11:00,2025-06-19,https://ted.europa.eu/en/notice/-/detail/396478-2025,https://platformazakupowa.pl/transakcja/1124178Szczeg,platformazakupowa,General links
